{
  "$schema": "https://json-schema.org/draft/2020-12/schema",
  "title": "CARRIER exploration v1 (positional kind order follows game_poi_kind; strictly increasing ranks from zero; nonzero total spawn weight)",
  "type": "object",
  "additionalProperties": false,
  "required": [
    "version",
    "tuning",
    "kinds",
    "ranks"
  ],
  "properties": {
    "version": {
      "const": 1
    },
    "tuning": {
      "type": "array",
      "prefixItems": [
        {
          "type": "number",
          "minimum": 1,
          "maximum": 30
        },
        {
          "type": "number",
          "minimum": 1,
          "maximum": 60
        },
        {
          "type": "number",
          "minimum": 500,
          "maximum": 5000
        },
        {
          "type": "number",
          "minimum": 1,
          "maximum": 1000
        },
        {
          "type": "number",
          "minimum": 8,
          "maximum": 100
        }
      ],
      "minItems": 5,
      "maxItems": 5
    },
    "kinds": {
      "type": "array",
      "prefixItems": [
        {
          "$ref": "#/$defs/kind"
        },
        {
          "$ref": "#/$defs/kind"
        },
        {
          "$ref": "#/$defs/kind"
        },
        {
          "$ref": "#/$defs/kind"
        },
        {
          "$ref": "#/$defs/kind"
        },
        {
          "$ref": "#/$defs/kind"
        },
        {
          "$ref": "#/$defs/kind"
        },
        {
          "$ref": "#/$defs/kind"
        },
        {
          "$ref": "#/$defs/kind"
        },
        {
          "$ref": "#/$defs/kind"
        },
        {
          "$ref": "#/$defs/kind"
        },
        {
          "$ref": "#/$defs/kind"
        },
        {
          "$ref": "#/$defs/kind"
        }
      ],
      "minItems": 13,
      "maxItems": 13
    },
    "ranks": {
      "type": "array",
      "prefixItems": [
        {
          "type": "array",
          "prefixItems": [
            {
              "type": "integer",
              "minimum": 0,
              "maximum": 1538
            },
            {
              "type": "string",
              "minLength": 1,
              "maxLength": 20,
              "pattern": "^[ -~]+$"
            }
          ],
          "minItems": 2,
          "maxItems": 2
        },
        {
          "type": "array",
          "prefixItems": [
            {
              "type": "integer",
              "minimum": 0,
              "maximum": 1538
            },
            {
              "type": "string",
              "minLength": 1,
              "maxLength": 20,
              "pattern": "^[ -~]+$"
            }
          ],
          "minItems": 2,
          "maxItems": 2
        },
        {
          "type": "array",
          "prefixItems": [
            {
              "type": "integer",
              "minimum": 0,
              "maximum": 1538
            },
            {
              "type": "string",
              "minLength": 1,
              "maxLength": 20,
              "pattern": "^[ -~]+$"
            }
          ],
          "minItems": 2,
          "maxItems": 2
        },
        {
          "type": "array",
          "prefixItems": [
            {
              "type": "integer",
              "minimum": 0,
              "maximum": 1538
            },
            {
              "type": "string",
              "minLength": 1,
              "maxLength": 20,
              "pattern": "^[ -~]+$"
            }
          ],
          "minItems": 2,
          "maxItems": 2
        },
        {
          "type": "array",
          "prefixItems": [
            {
              "type": "integer",
              "minimum": 0,
              "maximum": 1538
            },
            {
              "type": "string",
              "minLength": 1,
              "maxLength": 20,
              "pattern": "^[ -~]+$"
            }
          ],
          "minItems": 2,
          "maxItems": 2
        },
        {
          "type": "array",
          "prefixItems": [
            {
              "type": "integer",
              "minimum": 0,
              "maximum": 1538
            },
            {
              "type": "string",
              "minLength": 1,
              "maxLength": 20,
              "pattern": "^[ -~]+$"
            }
          ],
          "minItems": 2,
          "maxItems": 2
        },
        {
          "type": "array",
          "prefixItems": [
            {
              "type": "integer",
              "minimum": 0,
              "maximum": 1538
            },
            {
              "type": "string",
              "minLength": 1,
              "maxLength": 20,
              "pattern": "^[ -~]+$"
            }
          ],
          "minItems": 2,
          "maxItems": 2
        },
        {
          "type": "array",
          "prefixItems": [
            {
              "type": "integer",
              "minimum": 0,
              "maximum": 1538
            },
            {
              "type": "string",
              "minLength": 1,
              "maxLength": 20,
              "pattern": "^[ -~]+$"
            }
          ],
          "minItems": 2,
          "maxItems": 2
        },
        {
          "type": "array",
          "prefixItems": [
            {
              "type": "integer",
              "minimum": 0,
              "maximum": 1538
            },
            {
              "type": "string",
              "minLength": 1,
              "maxLength": 20,
              "pattern": "^[ -~]+$"
            }
          ],
          "minItems": 2,
          "maxItems": 2
        }
      ],
      "minItems": 9,
      "maxItems": 9
    }
  },
  "$defs": {
    "kind": {
      "type": "array",
      "prefixItems": [
        {
          "type": "string",
          "minLength": 1,
          "maxLength": 20,
          "pattern": "^[ -~]+$"
        },
        {
          "type": "array",
          "prefixItems": [
            {
              "type": "string",
              "minLength": 1,
              "maxLength": 30,
              "pattern": "^[ -~]+$"
            },
            {
              "type": "string",
              "minLength": 1,
              "maxLength": 30,
              "pattern": "^[ -~]+$"
            },
            {
              "type": "string",
              "minLength": 1,
              "maxLength": 30,
              "pattern": "^[ -~]+$"
            }
          ],
          "minItems": 3,
          "maxItems": 3
        },
        {
          "type": "number",
          "minimum": 20,
          "maximum": 1000
        },
        {
          "type": "number",
          "minimum": 1,
          "maximum": 1000
        },
        {
          "type": "integer",
          "minimum": 0,
          "maximum": 15
        },
        {
          "type": "integer",
          "minimum": 1,
          "maximum": 100000
        },
        {
          "type": "integer",
          "minimum": 0,
          "maximum": 100
        }
      ],
      "minItems": 7,
      "maxItems": 7
    }
  }
}
