{
  "version": 1,
  "tuning": [
    3,
    4,
    1400,
    180,
    18
  ],
  "kinds": [
    [
      "Veil pocket",
      [
        "Rare gas threads the cloud.",
        "Scoop fitted: collect gas.",
        "Shields slow; sensors halved."
      ],
      540,
      420,
      5,
      180,
      23
    ],
    [
      "Dark star",
      [
        "Clocks lag near the rim.",
        "Keep clear of the dark core.",
        "Survey grant: deep anomaly."
      ],
      800,
      120,
      8,
      4000,
      2
    ],
    [
      "Ice wanderer",
      [
        "Ice streams behind the body.",
        "Scoop minerals from the tail.",
        "Let its wake cross your bow."
      ],
      160,
      65,
      11,
      280,
      18
    ],
    [
      "Capital wreck",
      [
        "Last log: we held the line.",
        "Cargo bay pressure is zero.",
        "Watch the surviving gun."
      ],
      210,
      360,
      6,
      650,
      17
    ],
    [
      "Listening stone",
      [
        "Hold close for five seconds.",
        "The old current remembers.",
        "Five stones span the gulf."
      ],
      90,
      95,
      13,
      1100,
      8
    ],
    [
      "Unknown signal",
      [
        "Follow the narrow bearing.",
        "Could be help or a trap.",
        "Approach to resolve source."
      ],
      160,
      18,
      10,
      320,
      12
    ],
    [
      "Pulse lighthouse",
      [
        "A neutron heart beats here.",
        "The beam drinks ship energy.",
        "Hold outside the inner rim."
      ],
      480,
      85,
      14,
      900,
      5
    ],
    [
      "Companion star",
      [
        "Two suns share one silence.",
        "A calm scan hears harmony.",
        "Survey their common drift."
      ],
      360,
      250,
      12,
      550,
      8
    ],
    [
      "Ion squall",
      [
        "Charged dust crosses space.",
        "Energy drains in the cloud.",
        "Scanner echoes are scrambled."
      ],
      420,
      360,
      9,
      400,
      5
    ],
    [
      "Station ruins",
      [
        "Dock log: the tide went out.",
        "No voices on the old band.",
        "Stores remain in sealed bays."
      ],
      240,
      400,
      3,
      1300,
      1
    ],
    [
      "Generation ark",
      [
        "Forty lives between the suns.",
        "The children named the dark.",
        "Home was the voyage itself."
      ],
      300,
      650,
      7,
      6000,
      1
    ],
    [
      "Old Toothy",
      [
        "A shark carved by impacts.",
        "The oldest grin in the gulf.",
        "Someone left a tooth of gold."
      ],
      110,
      180,
      15,
      700,
      0
    ],
    [
      "LAKESHARK",
      [
        "LAKESHARK / LAKESHARK",
        "A finder grant waits here.",
        "Three jumps reveal a harbour."
      ],
      90,
      30,
      10,
      1200,
      0
    ]
  ],
  "ranks": [
    [
      0,
      "Drifter"
    ],
    [
      3,
      "Roamer"
    ],
    [
      8,
      "Wayfinder"
    ],
    [
      16,
      "Trailreader"
    ],
    [
      32,
      "Starmapper"
    ],
    [
      64,
      "Deepwalker"
    ],
    [
      128,
      "Void Scholar"
    ],
    [
      256,
      "Horizon Keeper"
    ],
    [
      512,
      "Cartographer"
    ]
  ]
}
